<?xml version="1.0"?>
<!DOCTYPE resume SYSTEM "../resume.dtd">
<resume>

<identity>
    <name>Hollis Lomax</name>
    <pronouns>He/him</pronouns>
</identity>

<contact>
    <email type="work">hlomax@missouri.edu</email>
</contact>

<skills>
    <tech tags="writing">Microsoft Word</tech>
    <tech tags="stats">Microsoft Excel</tech>
    <tech tags="design">Microsoft Powerpoint</tech>

    <proglang tags="writing">LaTeX</proglang> 
    <proglang tags="web,writing">HTML</proglang> 
    <proglang tags="web,design">CSS</proglang> 

    <language level="native">English</language>
    <language level="flient" cert="Goethe-Institut C1">German</language>

    <softskill tags="writing">Literary analysis</softskill>
    <softskill tags="teaching">Teaching</softskill>
</skills>

</resume>
